{
  "$schema": "http://json-schema.org/draft-07/schema#",
  "title": "GetWrite Project Type",
  "type": "object",
  "required": ["id", "name", "folders"],
  "properties": {
    "id": {
      "type": "string",
      "pattern": "^[a-z0-9-_]+$",
      "description": "Unique machine identifier for the project type (lowercase letters, digits, hyphen, underscore)."
    },
    "name": {
      "type": "string",
      "description": "Human-friendly project type name shown in the UI."
    },
    "description": {
      "type": "string",
      "description": "Optional longer description explaining the project type's intent and usage."
    },
    "folders": {
      "type": "array",
      "description": "An ordered list of folder definitions that will be created for projects of this type.",
      "items": {
        "type": "object",
        "required": ["name"],
        "description": "Definition of a single folder (name and any default resources).",
        "properties": {
          "name": {
            "type": "string",
            "description": "Folder name (must be unique within this array)."
          },
          "special": {
            "type": "boolean",
            "description": "Deprecated and ignored. Folder names no longer carry application-level semantics; retained only so older project-type files continue to validate."
          },
          "defaultResources": {
            "type": "array",
            "description": "Optional resources to pre-populate inside this folder when a new project is created.",
            "items": {
              "type": "object",
              "required": ["name", "type"],
              "properties": {
                "name": {
                  "type": "string",
                  "description": "Resource display name."
                },
                "type": {
                  "type": "string",
                  "enum": ["text", "image", "audio"],
                  "description": "Resource content type."
                },
                "template": {
                  "type": "string",
                  "description": "Optional template content or template id to seed the resource."
                },
                "metadata": {
                  "type": "object",
                  "description": "Arbitrary metadata for the resource."
                }
              }
            }
          }
        }
      }
    },
    "editorConfig": {
      "type": "object",
      "description": "Default editor configuration for projects of this type.",
      "properties": {
        "headings": {
          "type": "object",
          "description": "Default styles for editor headings.",
          "properties": {
            "h1": { "$ref": "#/$defs/editorHeading" },
            "h2": { "$ref": "#/$defs/editorHeading" },
            "h3": { "$ref": "#/$defs/editorHeading" },
            "h4": { "$ref": "#/$defs/editorHeading" },
            "h5": { "$ref": "#/$defs/editorHeading" },
            "h6": { "$ref": "#/$defs/editorHeading" }
          }
        },
        "body": {
          "type": "object",
          "description": "Default body text styles applied to paragraphs.",
          "properties": {
            "fontFamily": {
              "type": "string",
              "description": "CSS font-family value for body text. e.g. \"IBM Plex Serif\""
            },
            "fontSize": {
              "type": "string",
              "description": "CSS font-size for body text. e.g. \"15px\""
            },
            "lineHeight": {
              "type": "string",
              "description": "CSS line-height for body text. Unitless multipliers recommended. Minimum 1.8. e.g. \"1.8\""
            },
            "paragraphSpacing": {
              "type": "string",
              "description": "CSS margin applied above and below each paragraph. e.g. \"16px\" or \"1em\""
            }
          }
        }
      }
    },
    "defaultResources": {
      "type": "array",
      "items": {
        "$ref": "#/properties/folders/items/properties/defaultResources/items"
      }
    }
  },
  "additionalProperties": false,
  "$defs": {
    "editorHeading": {
      "type": "object",
      "properties": {
        "fontSize": {
          "type": "string",
          "description": "CSS font-size for the heading. e.g. \"32px\""
        },
        "fontFamily": {
          "type": "string",
          "description": "CSS font-family for the heading. e.g. \"IBM Plex Serif\""
        },
        "fontWeight": {
          "type": "string",
          "description": "CSS font-weight for the heading. e.g. \"400\" or \"700\""
        },
        "letterSpacing": {
          "type": "string",
          "description": "CSS letter-spacing for the heading. Em units recommended. e.g. \"0.05em\""
        },
        "color": {
          "type": "string",
          "description": "CSS color for the heading. Hex values only. Note: hard-coding a color bypasses the theme-aware ink token and will not respond to light/dark mode."
        }
      }
    }
  }
}
